{
  "schemaVersion": "1.0",
  "generatedAt": "2026-01-03T21:30:00Z",
  "dataSource": "manual_curation_with_verification",
  "events": [
    {
      "id": "2023-03-14-openai-gpt4-launch",
      "date": "2023-03-14",
      "provider": "OpenAI",
      "model": "GPT-4",
      "modelFamily": "gpt-4",
      "type": "new_model",
      "severity": "critical",
      "headline": "OpenAI Launches GPT-4 API",
      "oldPrice": null,
      "newPrice": { "input": 30.00, "output": 60.00 },
      "change": null,
      "description": "OpenAI released GPT-4, the most capable large language model at the time. Set the benchmark for frontier model pricing at $30/MTok input and $60/MTok output for the 8K context version.",
      "impact": "Established the pricing standard for frontier-class models. 32K context version priced at $60/$120.",
      "sourceUrl": "https://openai.com/blog/gpt-4",
      "verifiedAt": "2026-01-03T00:00:00Z",
      "confidence": "high",
      "notes": "8K context version. 32K context was $60/$120 per MTok.",
      "tags": ["openai", "gpt-4", "new-model", "frontier", "landmark"]
    },
    {
      "id": "2023-07-11-anthropic-claude2-launch",
      "date": "2023-07-11",
      "provider": "Anthropic",
      "model": "Claude 2.0",
      "modelFamily": "claude-3",
      "type": "new_model",
      "severity": "high",
      "headline": "Anthropic Launches Claude 2 with 100K Context",
      "oldPrice": null,
      "newPrice": { "input": 8.00, "output": 24.00 },
      "change": null,
      "description": "Anthropic released Claude 2.0 with an industry-first 100K token context window, dramatically exceeding the 32K limits of competitors at the time.",
      "impact": "First major model with 100K context. Priced significantly below GPT-4 at 73% less for input tokens.",
      "sourceUrl": "https://www.anthropic.com/news/claude-2",
      "verifiedAt": "2026-01-03T00:00:00Z",
      "confidence": "high",
      "notes": "100K context window was groundbreaking when GPT-4 maxed at 32K.",
      "tags": ["anthropic", "claude-2", "new-model", "context-window"]
    },
    {
      "id": "2023-11-06-openai-gpt4-turbo-launch",
      "date": "2023-11-06",
      "provider": "OpenAI",
      "model": "GPT-4 Turbo",
      "modelFamily": "gpt-4",
      "type": "new_model",
      "severity": "critical",
      "headline": "OpenAI Launches GPT-4 Turbo with 66% Price Cut",
      "oldPrice": { "input": 30.00, "output": 60.00 },
      "newPrice": { "input": 10.00, "output": 30.00 },
      "change": { "input": -0.67, "output": -0.50 },
      "description": "OpenAI released GPT-4 Turbo at DevDay, featuring 128K context and prices slashed to $10/$30 per MTok - a 67% reduction for input and 50% for output.",
      "impact": "Massive price disruption. Made GPT-4-class models accessible to many more developers. 128K context became the new standard.",
      "sourceUrl": "https://openai.com/blog/new-models-and-developer-products-announced-at-devday",
      "verifiedAt": "2026-01-03T00:00:00Z",
      "confidence": "high",
      "notes": "DevDay 2023 announcement. Also introduced vision capabilities.",
      "tags": ["openai", "gpt-4-turbo", "price-drop", "devday", "landmark"]
    },
    {
      "id": "2024-01-25-openai-gpt35-price-cut",
      "date": "2024-01-25",
      "provider": "OpenAI",
      "model": "GPT-3.5 Turbo",
      "modelFamily": "gpt-3.5",
      "type": "price_drop",
      "severity": "high",
      "headline": "OpenAI Cuts GPT-3.5 Turbo Prices by 50%",
      "oldPrice": { "input": 1.00, "output": 2.00 },
      "newPrice": { "input": 0.50, "output": 1.50 },
      "change": { "input": -0.50, "output": -0.25 },
      "description": "OpenAI reduced GPT-3.5 Turbo pricing with 50% cut on input tokens and 25% on output tokens, alongside fixing the 'lazy GPT-4' issue.",
      "impact": "Made efficient-tier models even more cost-effective. Signaled aggressive pricing competition.",
      "sourceUrl": "https://openai.com/blog/new-embedding-models-and-api-updates",
      "verifiedAt": "2026-01-03T00:00:00Z",
      "confidence": "high",
      "notes": "Also introduced new embedding models at this time.",
      "tags": ["openai", "gpt-35", "price-drop", "efficient-tier"]
    },
    {
      "id": "2024-03-04-anthropic-claude3-launch",
      "date": "2024-03-04",
      "provider": "Anthropic",
      "model": "Claude 3 (Opus/Sonnet/Haiku)",
      "modelFamily": "claude-3",
      "type": "new_model",
      "severity": "critical",
      "headline": "Anthropic Launches Claude 3 Family with Three Tiers",
      "oldPrice": null,
      "newPrice": { "input": 15.00, "output": 75.00 },
      "change": null,
      "description": "Anthropic released the Claude 3 family with three tiers: Opus ($15/$75), Sonnet ($3/$15), and Haiku ($0.25/$1.25). First multi-tier model family with clear capability/price tradeoffs.",
      "impact": "Established the tiered model approach that became industry standard. Opus beat GPT-4 on many benchmarks.",
      "sourceUrl": "https://www.anthropic.com/news/claude-3-family",
      "verifiedAt": "2026-01-03T00:00:00Z",
      "confidence": "high",
      "notes": "Opus pricing shown. Sonnet: $3/$15, Haiku: $0.25/$1.25. 200K context window.",
      "tags": ["anthropic", "claude-3", "new-model", "frontier", "tiered-pricing", "landmark"]
    },
    {
      "id": "2024-05-13-openai-gpt4o-launch",
      "date": "2024-05-13",
      "provider": "OpenAI",
      "model": "GPT-4o",
      "modelFamily": "gpt-4o",
      "type": "new_model",
      "severity": "critical",
      "headline": "OpenAI Launches GPT-4o with 50% Price Cut from GPT-4 Turbo",
      "oldPrice": { "input": 10.00, "output": 30.00 },
      "newPrice": { "input": 5.00, "output": 15.00 },
      "change": { "input": -0.50, "output": -0.50 },
      "description": "OpenAI released GPT-4o (omni), a natively multimodal model with 50% lower prices than GPT-4 Turbo. Native audio and vision capabilities built in.",
      "impact": "Continued aggressive price erosion. Multimodal capabilities at frontier prices set new bar for model value.",
      "sourceUrl": "https://openai.com/index/hello-gpt-4o/",
      "verifiedAt": "2026-01-03T00:00:00Z",
      "confidence": "high",
      "notes": "Later reduced further to $2.50/$10. 'Omni' = multimodal native.",
      "tags": ["openai", "gpt-4o", "new-model", "multimodal", "price-drop"]
    },
    {
      "id": "2024-05-14-google-gemini15-flash-launch",
      "date": "2024-05-14",
      "provider": "Google",
      "model": "Gemini 1.5 Flash",
      "modelFamily": "gemini-1.5",
      "type": "new_model",
      "severity": "high",
      "headline": "Google Launches Gemini 1.5 Flash for High-Volume Use Cases",
      "oldPrice": null,
      "newPrice": { "input": 0.35, "output": 1.05 },
      "change": null,
      "description": "Google launched Gemini 1.5 Flash, a lightweight model optimized for speed and cost efficiency. Designed for high-volume, high-frequency tasks with 1M token context.",
      "impact": "Undercut GPT-3.5 Turbo pricing while offering longer context. Established Google's competitive position in efficient tier.",
      "sourceUrl": "https://developers.googleblog.com/en/gemini-15-flash-updates-google-ai-studio-gemini-api/",
      "verifiedAt": "2026-01-03T00:00:00Z",
      "confidence": "high",
      "notes": "1M context window. Later received 78%/71% price cuts in August 2024.",
      "tags": ["google", "gemini-flash", "new-model", "efficient-tier", "context-window"]
    },
    {
      "id": "2024-06-20-anthropic-claude35-sonnet-launch",
      "date": "2024-06-20",
      "provider": "Anthropic",
      "model": "Claude 3.5 Sonnet",
      "modelFamily": "claude-3.5",
      "type": "new_model",
      "severity": "critical",
      "headline": "Anthropic Launches Claude 3.5 Sonnet at Sonnet Price",
      "oldPrice": null,
      "newPrice": { "input": 3.00, "output": 15.00 },
      "change": null,
      "description": "Anthropic released Claude 3.5 Sonnet with Opus-level capabilities at the Sonnet price point ($3/$15). 2x faster than Claude 3 Sonnet with significant quality improvements.",
      "impact": "Disrupted value equation - flagship-quality at mid-tier price. Became one of the most popular API models.",
      "sourceUrl": "https://www.anthropic.com/news/claude-3-5-sonnet",
      "verifiedAt": "2026-01-03T00:00:00Z",
      "confidence": "high",
      "notes": "Same price as Claude 3 Sonnet but with Opus-level quality. Introduced Artifacts feature.",
      "tags": ["anthropic", "claude-35-sonnet", "new-model", "frontier", "landmark"]
    },
    {
      "id": "2024-07-18-openai-gpt4o-mini-launch",
      "date": "2024-07-18",
      "provider": "OpenAI",
      "model": "GPT-4o Mini",
      "modelFamily": "gpt-4o",
      "type": "new_model",
      "severity": "critical",
      "headline": "OpenAI Launches GPT-4o Mini at $0.15/$0.60",
      "oldPrice": null,
      "newPrice": { "input": 0.15, "output": 0.60 },
      "change": null,
      "description": "OpenAI released GPT-4o Mini, their most cost-effective model. At $0.15/$0.60 per MTok, it's 60% cheaper than GPT-3.5 Turbo while outperforming it on benchmarks.",
      "impact": "Massive disruption to efficient tier pricing. Made GPT-4-class quality accessible at sub-$1/MTok prices.",
      "sourceUrl": "https://openai.com/index/gpt-4o-mini-advancing-cost-efficient-intelligence/",
      "verifiedAt": "2026-01-03T00:00:00Z",
      "confidence": "high",
      "notes": "Replaced GPT-3.5 Turbo as the recommended efficient model.",
      "tags": ["openai", "gpt-4o-mini", "new-model", "efficient-tier", "landmark"]
    },
    {
      "id": "2024-08-12-google-gemini15-flash-price-cut",
      "date": "2024-08-12",
      "provider": "Google",
      "model": "Gemini 1.5 Flash",
      "modelFamily": "gemini-1.5",
      "type": "price_drop",
      "severity": "critical",
      "headline": "Google Slashes Gemini 1.5 Flash Prices by 78%",
      "oldPrice": { "input": 0.35, "output": 1.05 },